0,1,2,3,4,5,6
港まつり福引大売出し,港まつり福引大売出し、6月28日→7月6日、100円お買上毎に福引券1枚進呈、賞品　1等50000円1本、副賞　トーア毛糸（1ポンド）1本、トーア賞　トーア毛糸（半ポンド）10本、2等　1000円6本、3等　500円9本、4等　国産キャラメル15000本、5等　空ぐじ15枚でニュー東宝招待券引換、主催　函館市・函館商工会議所、ハコー印刷会社印行、サインあり,,,53.5×75.5cm,,po000105
開港97年はこだて港まつり,開港97年はこだて港まつり、7月1日→5日、主催　函館市・函館港祭協賛会・函館商工会議所・青函鉄道管理局、函館・辻印刷所印行、サインあり,,,76.0×53.0cm,,po000109
開港九十四周年・北洋漁業再開記念　港まつり,開港九十四周年・北洋漁業再開記念港まつり、7月1日～6日、主催　函館市・函館港まつり協賛会、広告税　昭和27年6月19日印,,,75.0×52.0cm,,po000110
松竹大歌舞伎特別公演,松竹大歌舞伎特別公演、板東三津五郎、市村竹之丞、大谷友右衛門、沢村由次郎、板東慶三、沢村田之助、中村雀右衛門、義経千本桜　川連法眼館一幕、お目見得　口上、岡本綺堂作　修禅寺物語三場、新歌舞伎十八番の内　鏡獅子長唄囃子連中、7月2日、昼12寺半・夜5寺半　開演、観劇料（指定席）、特別席2000円、一等席1500円、二等A席1000円、二等B席800円、二等C席500円、前売所　北海道新聞函館支社、支局及び函館市内プレーガイド、お問い合せ　北海道新聞函館支社事業部　TEL23-2111、会場　函館市民会館、主催　函館市文化団体協議会・函館市民劇場運営委員会・函館市教育委員会・北海道新聞社、昭和45年4月23日受付印,,,77.0×52.0cm,,po000111
開港九十五周年　港まつり,開港九十五周年港まつり、7月1日→5日、明年開催　北洋漁業再開記念　大博覧会29年7～8月、函館市・国有鉄道（青函）、函館・ハコー印刷印行、サインあり、開港95周年記念函館港まつり行事表付き,,,75.5×53.5cm,,po000114
開港107年記念はこだて港まつり,開港107年記念はこだて港まつり、7月1日→5日、主催　函館市・函館港まつり協賛会、函館・第一印刷印行、サインあり,,,75.0×53.0cm,,po000115
優良児童図書展示会,,,,58.5×41.0cm,,po000117
市民のための大学開放講座,市民のための大学開放講座　文部省委嘱、講座名　古典と人生、講座内容　歴史と人生　北海道教育大学教授　小栗了之、老荘の真実相　助教授　加賀栄治、言葉の教育と古典　助教授　山岸悦郎、チョーサー・シェイクスピアの系譜　助教授　小名提郎、万葉の幻想　助教授　鎌田広夫、言語学の古典　助教授　田村光規、古典の言葉　講師　葛西清蔵、漱石と鴎外　助教授　安東璋二、内村鑑三と現代　助教授　秦慎二、古典と人間教育　教授　舟越芳男、期間　八月一日（土）から八月三十日（日）まで毎週土・日曜日　午後六時から一講座三時間、受講人数　約五〇名（男・女資格は問いません）、受講料　七五〇円、会場　北海道教育大学函館分校、申込先　函館市八幡町一番二号北海道教育大学函館分校教務係（電話五二-一一二一）、共催　北海道教育大学函館分校・北海道教育庁渡島教育局・函館市教育委員会、昭和45年7月12日,,,36.0×51.0cm,,po000118
平成6年度特別展　箱館夢日記＝箱館と南部藩＝,平成6年度特別展　箱館夢日記＝箱館と南部藩＝、主催　市立函館博物館、後援　盛岡市中央公民館・NHK函館放送局・北海道新聞函館支社・箱館奉行所復元促進期成会・五稜郭タワー株式会社・市立函館博物館友の会、会場　市立函館博物館五稜郭分館（五稜郭公園内）TEL.0138-51-2548、会期　平成6年7月26日（火）～9月25日（日）月曜日休館、観覧料　一般400円、大・高校生200円、中・小学生100円（団体割引有り）、平成6年9月30日印あり,,1994年,51.5×73.0cm,,po000120
寺崎広業展,寺崎広業展、薫りたつ明治の雅、平成6年8月27日（土）～9月25日（日）、月曜日休館・午前10時～午後5時（入館は4時30分まで）※会期中一部作品の展示替えを行います、観覧料/一般610(510)円・高大生510(410)円・小中生300(200)円、（）内は前売り・10名以上の団体料金、主催/北海道立函館美術館・北海道新聞社、後援/函館市・函館市教育委員会・NHK函館放送局・uhb、北海道立函館美術館、〒040函館市五稜郭町37番6号　TEL(0138)56-6311　テレフォンサービス(0138)55-1551、サインあり、平成6年9月30日印あり,,,73.0×51.5cm,,po000121
冬の交通事故防止運動,昭和45年1月17日受付印,,,59.5×84.0cm,,po000123
港まつり,港まつり、7月1日→5日、函館市、株式会社　北海商報社印行、はんこあり,,,75.0×52.0cm,,po000139
みんなで一掃き　たのしい一日,函館の街をきれいにする市民運動標語入選作品、みんなで一掃き　たのしい一日、函館の街をきれいにする市民運動協議会、サインあり,,,53.0×18.5cm,,po000165
開館5周年記念　夷酋列像200年　蠣崎波響とその時代展,開館5周年記念・夷酋列像200年　蠣崎波響とその時代展、1991年8月27日（火）～9月23日（月）、開館時間/午前10時～午後5時（入場は午後4時30分まで）、月曜休館　ただし9月15日（日）〈敬老の日〉・9月23日（月）〈秋分の日〉は開館いたします。観覧料　一般　920円（当日）720円（前売・団体）・高大生720円（当日）510円（前売・団体）・小中生410円（当日）300円（前売・団体）、主催　北海道立函館美術館・美術館連絡協議会・読売新聞社、後援　文化庁・函館市・函館市教育委員会・STV・NHK函館放送局、協賛　花王、北海道立函館美術館、〒040函館市五稜郭町37番6号、TEL(0138)56-6311、テレフォンサービスTEL(0138)55-1551、平成3年8月28日印あり,,,73.0×51.5cm,,po000180
6月1日～7日　水道週間,昭和46年5月26日受付印,,,73.0×51.5cm,,po000183
青少年のために,昭和46年4月30日受付印,,,51.5×73.0cm,,po000189
呼んでる待ってる北方領土,昭和48年4月17日受付印,,,78.5×55.5cm,,po000190
国際フォトニュース　かけ声の仲間,昭和48年6月7日,,,52.5×75.0cm,,po000196
海外研修生募集,昭和45年3月13日受付印,,,73.0×52.0cm,,po000198
国をささえる若い力　自衛官募集,昭和45年1月17日受付印,,,71.5×51.5cm,,po000199
国際フォトニュース　富士に鍛える,昭和48年11月14日,,,54.0×76.0cm,,po000200
国際フォトニュース　大空の祭典,昭和48年11月29日,,,53.0×76.0cm,,po000201
赤十字看護学生募集,昭和48年10月11日,,,74.5×53.0cm,,po000202
第19回　三国バレエ発表会,第19回三国バレエ発表会、10月18日（土）PM2:30/6:30、HBC劇場　大人200円・子供150円、主催/三国バレエ研究所、後援/函館市教育委員会・北海道新聞函館支社、サインあり、昭和44年10月9日受付印,,,73.0×51.5cm,,po000205
きょうは税の相談日よ,昭和44年12月13日受付印,,,67.5×49.0cm,,po000206
たすけあって！赤い羽根のよろこびを,昭和45年3月7日受付印,,,73.0×51.5cm,,po000208
正しい計量　明るい社会,昭和45年3月7日受付印,,,51.0×73.0cm,,po000209
明るい家庭に明るい子供,,,,51.5×73.0cm,,po000211
警察官採用,昭和45年5月23日受付印,,,73.0×51.0cm,,po000212
春の交通安全運動,昭和45年5月23日受付印,,,72.0×51.5cm,,po000213
北海道中堅青年海外派遣団員募集,昭和44年9月2日受付印,,,59.5×42.0cm,,po000214
第24回学生広告論文伝通賞作品募集,昭和46年10月18日受付印,,,72.5×49.5cm,,po000217
航空管制官募集,,,,51.5×36.5cm,,po000220
昭和48年度　北海道図書館大会,,,,36.5×26.0cm,,po000222
昭和49年度　慶應義塾大学通信教育部学生募集,昭和49年2月5日,,,72.5×34.0cm,,po000223
函館市民会館落成記念バレエフェスティバル,函館市民会館 7月20日（月）午後6:30、函館市民会館落成記念バレエフェスティバル、主催　函館バレエアカデミー・三国バレエ研究所、後援　函館市、サインあり、昭和45年7月10日受付印,,,73.0×52.0cm,,po000224
明治はるあき,昭和44年9月9日受付印,,,76.0×53.5cm,,po000226
第7回奨学論文コンテスト,昭和46年9月7日受付印,,,59.0×41.5cm,,po000228
教護になりませんか　第二十七期生募集,昭和48年1月12日受付印,,,52.0×37.0cm,,po000229
芸術祭バレエ北海道公演　第10回東京バレエグループ公演,芸術祭バレエ北海道公演　第10回東京バレエグループ公演、〈ロミオとジュリエット〉ジュリエット＝森下洋子（牧阿佐美バレエ団）、ロミオ＝清水哲太郎（松山樹子バレエ団）、ティボルト＝江川明、マーキューショー＝漆原宏樹、愛＝亀ヶ谷環、マブの女王＝宮木里恵子、〈交響曲〉新井雅子、江川明、畑佐俊明、石塚千香子、竹屋啓子、清水敏子、宮木百合子、寺田洋子、小林道子、浅沼知子、青柳静枝、岩朝保子、根本美香、鈴木和子、藤井友子、江原朋子、遠藤展弘、河野潤、五木田勲、佐藤栄弥、岩崎一、久光孝男、東京バレエグループ、構成・演出・振付＝横井茂、技術指導＝石井清子、音楽監督＝若杉弘、装置＝藤本久徳、照明＝大庭三郎、衣装＝田代洋子、音響＝清水秀臣、舞台監督＝茂木源光、衣装製作＝大井昌子、主催　文化庁芸術祭執行委員会・芸術祭バレエ北海道公演実行委員会・北海道国際文化協会・芸術祭バレエ北海道公演函館市実行委員会、後援　北海道教育委員会・函館市文化団体協議会・10月12日（日）PM6:30（開場6:00）、会場　函館市民会館、料金　A=1000円 B=700円 C=500円、お問い合せ　函館市教育委員会社会教育課（23-6161 内線171）、バレエ詩劇〈べルりオーズ曲〉、ロミオとジュリエット〈松村禎三曲〉交響曲、制作＝日本ゼネラルアーツ、昭和45年10月12日受付印,,,73.0×52.0cm,,po000231
第10回全国青年政治討論会,昭和45年7月11日受付印,,,54.5×39.5cm,,po000233
第22回学生広告論文電通賞作品募集,昭和44年10月24日受付印、第22回学生広告論文電通賞募集要綱の紙付き,,,73.0×51.5cm,,po000236
高校生の作文募集　税金についての意見や感想を書いてみよう,昭和45年7月22日受付印,,,72.5×52.0cm,,po000238
札幌オリンピック善意通訳募集,昭和46年10月14日受付印,,,72.5×47.5cm,,po000239
第3期　成人学校受講生募集,第3期成人学校受講生募集、受付　8月29日～9月10日、場所　市役所案内（市民の室）、定員・受講料　各科目40名1科目400円、開講　9月10日～11月4日、場所　市立旭中学校、時間　午後6時～8時、月・木コース　料理A・社交ダンス・木彫・ボウリング・洋裁、火・金コース　料理B・ペン習字・ボウリング・リボンフラワー・ペーパーフラワー・民謡、函館市教育委員会、昭和45年9月3日受付印,,,37.0×52.0cm,,po000241
海上保安大学校　水路科・燈台科・普通科　気象大学校学生募集,海上保安大学校　水路科・燈台科・普通科　気象大学校学生募集、受付期間 11月25日（水）→12月10日（木）、第1次試験　昭和46年1月16日（土）17日（日）、受験資格　高卒または昭46.3卒見の者で大学校学生は昭25.4.2以降、学校学生は昭22.4.2以降生まれの男子、待遇　在学中給与支給、授業料不要、人事院・海上保安庁・気象庁、問い合わせ先　問い合わせは返信用切手添付の封筒を同封のこと函館海上保安部、函館市海岸町24番4号、昭和45年10月23日受付印,,,72.5×51.5cm,,po000242
第14回こどもの読書週間,昭和47年5月2日受付印,,,59.5×42.0cm,,po000243
松前,,,,77.0×53.0cm,,po000248
オリンピックへぼくらの代表選手を！,,,,72.5×51.5cm,,po000249
札幌オリンピックを成功させよう。北海道,,,,75.0×52.5cm,,po000250
国家公務員募集,昭和46年6月9日受付印,,,73.0×51.5cm,,po000252
千代田学園　旧千代田テレビ技術学校,昭和46年8月5日受付印,,,72.5×51.5cm,,po000254
物価抑制特別貯蓄運動,昭和49年2月26日のサインあり　,,,36.5×51.5cm,,po000260
ひとりで行かないムリしない,ひとりで行かないムリしない、函館市児童生徒水難防止協議会、サインあり,,,38.0×53.0cm,,po000263
学生募集　学士号授与　教職課程併設,昭和49年2月21日のサインあり,,,70.0×42.0cm,,po000264
国家公務員募集,,,,72.5×51.0cm,,po000267
よみがえる都市河川,昭和48年12月2日のサインあり,,,51.5×72.5cm,,po000268
№38　青少年フォトニュース,,,,51.0×72.0cm,,po000269
国際フォトニュース　NOWな青春若人の祭典！,昭和49年1月16日のサインあり　,,,53.5×76.0cm,,po000270
Photo Study 1973 №5,昭和48年6月5日のサインあり,,,61.0×86.5cm,,po000271
Photo Study 1973 №7,昭和48年8月7日のサインあり,,,62.5×88.0cm,,po000272
Photo Study 1973　№9,昭和48年10月12日のサインあり,,,62.0×87.0cm,,po000273
Photo Study 1973,昭和49年1月5日のサインあり,,,53.0×73.5cm,,po000274
国際フォトニュース　海原はるか硫黄島,昭和48年7月5日のサインあり,,,53.0×75.5cm,,po000278
水道があって明るい今日がある　6月1日～7日/第12回・水道週間　,昭和45年5月28日受付印,,,54.0×76.0cm,,po000292
鯖戸英郎氏・サルコリー氏・ハース氏・ヘンリエッタペレス夫人　演奏会,,,,92.5×32.0cm,,po000294
洋画家　半切画展覧会,洋畫家　半切画展覧会、函館図書館主催、日時　八月十七・十八・十九日　毎自午前八時　日至午后五時、場所　公園内函館図書館、入場料　金五銭,,,54.5×39.5cm,,po000301
小村真太郎　洋画版画展覧会,小村真太郎　洋画・版画展覧会、並びに後期印象派・未来派・立体派・カンゲンスキー、会場・日時　公園函館図書館於　九月廿四・廿五・廿六日　毎日前　九時ヨリ午後六時マデ、主催　函館図書館　太陽の都社,,,54.5×39.5cm,,po000302
第九十七回　札幌修身講話会,,,,36.0×63.5cm,,po000304
第10回　札幌修身講話会,,,,36.0×63.5cm,,po000305
第3回公演　国防資献金音楽会,第3回公演　国防資献金音楽会、日時　11月24日夜（日曜日）6時、元町　公会堂於、主催　函館市連合青年団・函館市役所教育課、後援　市内各新聞社・古屋楽器店、ボーニ萩野呉服店、第3回公演音楽会のプログラムの紙付き,,,54.5×38.0cm,,po000309
北光トリオ第一回大演奏会,北光トリオ第一回大演奏会、ヴァイオリン　田上義氏、チェロ　飯田実氏、ピアノ　小川隆子夫氏、伴奏　山本夛三郎氏、11月22日夕方7時、公会堂於、主催　銀座楽器店、会費　一円、学生券　五十銭,,,55.0×40.0cm,,po000311
筑前琵琶宗家　橘旭宗先生歓迎大演奏会,筑前琵琶宗家　橘旭宗先生歓迎大演奏会、日時　七月廿四日（日曜日）四時半開会、場所　公会堂、後援　函館毎日新聞社・函館新聞社・函館日日新聞社・北海新聞社・北海タイムス社支局・小樽新聞社支局、主催　北海道橘会・日本蓄音器商会,,,54.5×39.5cm,,po000312
音楽大演奏会,音楽大演奏会、宮内省雅楽療教授大ヴァイオリニスト　窪兼雅氏、東京女子音楽学校声楽科・ピアノ科講師　木村文子嬢・藤田靜子嬢・小林春子嬢・田中栄子嬢・小出政子嬢、七月二十三日午後六時半、公会堂於、会費　普通100　学生50、主催　函館新聞社、後援　ヤマコ楽器店・古屋楽器店,,,54.5×39.5cm,,po000313
音楽と童謡舞踊の夕,軍人遺家族救護資金造成　音楽と童謡舞踊の夕、日時　六月二十五日（土）午後六時半、会場　元町公会堂、会券　大人五十銭　小人二十銭、主催　函館市社会課・函館市兵籍課、後援　津軽要塞司令部・函館連隊區司令部・帝国在郷軍人会函館市連合分会,,,55.0×39.5cm,,po000314
第一回　演奏会,第一回演奏会、11月4日午后七時　公会堂於、後援　函館毎日新聞社・ヤマコ楽器店、函館リードバンド,,,54.0×39.0cm,,po000315
画邦　橋浦泰雄個人展覧会,画邦　橋浦泰雄個人展覧会、五月十六・十七日、公園図書館於、会券20セン,,,47.0×58.0cm,,po000316
児童自由画懸賞募集,,,,44.5×62.0cm,,po000317
マンドリンオルケストラ公開演奏会,マンドリンオルケストラ公開演奏会、日時　一月十七日（土）午後六時、場所　舩場町万古ホテル演藝場、主催　函館プレクトラム・オルケストラ、後援　函館新聞社,,,64.0×47.0cm,,po000318
明治大学ハーモニカ　ソサェティー大演奏会,明治大学ハーモニカ　ソサェティー大演奏会、日時　大正十四年七月十八日午後六時、会場　公会堂、主催　明治大学北海道人会、後援　明大函館会、会員券　特等券100　普通券　学生券50,,,64.5×48.0cm,,po000319
コロムビア専属芸術家　巴里ラムルウ管弦楽団独唱者　佐藤美子独唱会,コロムビア専属藝術家　巴里ラムルウ管弦楽団独唱者　佐藤美子独唱会、日時　昭和七年十月十三日（木）午後六時半ヨリ、会場　元町公会堂、主催　函館市社会課、後援　市内各新聞社、コロムビアレコード,,,64.0×47.0cm,,po000320
我が楽界の巨星　山田耕作氏作品発表大演奏会,我が楽界の巨星　山田耕作氏作品発表大演奏会、期日　六月二十九日（土曜日）午後七時、会場　巴座、会券￥1.20（白）　￥0.60（青）、ピアノ　山田耕作氏、ヴァイオリン　黒柳守綱氏、ソプラノ　河原喜久恵嬢、主催　函館新聞社、後援　山田耕作後援会,,,78.0×34.0cm,,po000321
駒ヶ嶽爆発罹災義捐大演奏会　早稲田大学オーケストラ団一行,駒ヶ嶽爆發罹災義捐大演奏会　早稲田大学オーケストラ団一行、総指揮　小松平五郎氏、ソプラノ　般若初代嬢、ヴァイオリン　叶田義雄氏、日時　七月二十一日　晝　午後一時より　夜午後六時より、会場　巴座於、主催　函館早稲田倶楽部、後援　函館毎日新聞社・函館日日新聞社・函館新聞社・函館北海新聞社・北海タイムス支局・小樽新聞支局,,,79.2×36.7cm,,po000322
久留島武彦氏　お伽二十五周年記念会,,,,77.0×36.0cm,,po000326
声楽の夕,声楽の夕、ソプラノ　鈴木稲子嬢、ベース　阿部英雄氏、ピアニスト　福嶋捨子嬢、時　十一月八日（土）午后七時、所　公会堂、主催　高商音楽部、後援　小樽高商校友会函館支部、会費￥0.50（学生）￥1.00￥2.00,,,78.0×54.0cm,,po000328
満州事情展覧会,満州事情展覧会、八月六日ヨリ八月廿日マデ、新川小学校、後援　函館運輸事務所、主催　函館商工組合連合会、後援　函館市・函館商工会議所・南満州鉄道会社・東京日日新聞社・市内各新聞社、サインあり,,,75.5×52.0cm,,po000329
海の展覧会,海の展覧会、会期　大正十五季　自八月二日　至八月十六日、会場　宝小学校、EXHIBITION OF THE SEA、HAKODATE、AUG.2～16.1926　　,,,76.0×53.0cm,,po000330
釧路海陸物産共進会,,,,76.0×53.0cm,,po000336
市立電気科学館,,,,77.0×54.0cm,,po000355
開館一周年　市立電気科学館,,,,77.5×53.0cm,,po000361
全国発明品展覧会,,,,78.0×52.0cm,,po000373
北海道衛生展覧会,サインあり,,,80.0×56.0cm,,po000384
網走外三郡物産共進会,,,,77.0×55.0cm,,po000387
第三回札幌工業品々評会,,,,78.0×53.0cm,,po000388
第二回十勝物産共進会,,,,76.5×53.5cm,,po000391
後志物産共進会,,,,61.5×47.0cm,,po000395
山形県郷土史料大展覧会,,,,78.0×52.5cm,,po000399
東郷元帥米寿記念展覧会,,,,76.0×53.0cm,,po000400
道産愛用展覧会,,,,75.0×52.0cm,,po000403
福島競馬,サインあり,,,75.0×52.5cm,,po000410
酒田競馬,,,,74.5×51.0cm,,po000411
第十九回樺太大競馬会,,,,71.5×53.5cm,,po000412
福島競馬,,,,76.5×53.0cm,,po000414
春季函館競馬,春季函館競馬、馬券大當（金二百円）、開催日七月十一・十二・十八・十九（土・日曜日）前十一時、出場馬匹百十余頭（名馬揃）、函館競馬倶楽部、函館ハコー印刷会社印行,,,76.0×53.5cm,,po000418
帝室御賞典函館競馬,帝室御賞典函館競馬、、昭和三年秋季、開催時日　九月十二日（水曜）十三日（木曜）十五日（土曜）十六日（日曜）、社団法人函館競馬倶楽部、函館第一印刷株式会社印行,,,79.0×53.0cm,,po000419
昭和六年秋季　八雲競馬,,,,78.0×34.5cm,,po000427
日本一の白河馬市,,,,77.5×36.5cm,,po000428
鉄道図書館訓,,,,52.5×38.0cm,,po000453
館内配置書架案内,,,,57.0×37.5cm,,po000454
記念緑化運動,函館市復興緑樹婦人団、記念緑化運動、函館市復興緑樹婦人団3月21日、グリーンベルトは婦人の手で、第一印刷納,,,37.5×53.0cm,,po000457
植樹祭,,,,52.0×38.0cm,,po000458
お互に道路を愛しませう,,,,76.5×52.5cm,,po000459
道は世の為人の為ともに改良致しませう,,,,76.5×53.0cm,,po000460
覚めよ道路改善に,覚めよ道路改善に、函館道路改善会、函館ハマナカ石印　,,,78.5×54.0cm,,po000461
衛生都市の建設,衛生都市の建設、郷土美化、道路の清潔整頓、函館市衛生組合連合会、函館市役所、函館警察署、ハコー印刷会社印行、市民各位への紙付き、サインあり　　　　　　　　　　　,,,77.0×53.0cm,,po000462
道路の改良と愛護は万人の幸福,サインあり,,,73.5×50.0cm,,po000463
お互に道路を愛しませう,サインあり,,,77.0×52.5cm,,po000464
度量衡記念日,,,,77.5×36.5cm,,po000465
四月十一日度量衡記念日,,,,78.0×36.5cm,,po000466
米ハキログラムデ買ヒマセウ,,,,77.5×27.0cm,,po000467
メートルデー,,,,39.0×54.0cm,,po000468
来ル四月十一日ヨリ白米ハメートル法デ小売シマス,,,,52.5×31.0cm,,po000469
銃後健康報国　,銃後健康報国、健康週間　五月二日（第一日）清潔整頓ノ日、身体ノ清潔、住居内外ノ整頓、道路ノ清掃、五月三日（第二日）栄養改善ノ日、栄養料理ノ普及、胚芽米食ノ勵行、五月四日（第三日）結核撲滅ノ日、日光浴、外気生活、徒歩勵行、結核早期治療、五月五日（第四日）母子保健ノ日、母性、乳幼児健康増進、健康相談所利用、五月六日（第五日）近視齲歯予防ノ日、視力保存、齲歯ノ予防治療、五月七日（第六日）民族淨血ノ日、国民ノ純潔、花柳病予防撲滅、五月八日（第七日）防疫強化ノ日、飲食物ノ注意、博染病予防の勵行、蝿族驅除、国民協力、昭和一四、函館市　,,,39.5×54.0cm,,po000474
健康週間,サインあり,,,77.5×53.5cm,,po000475
十月十日全国視力保存デー,十月十日　全国視力保存デー、眼をまもれ、十六日まで｛各眼科専門醫で眼疾無料相談竝眼鏡処方箋料二割引、北海道眼鏡協会員の店にて眼鏡市価の二割引帝電会社は高燭変更申込者に電球無料奉仕、主催｛函館市役所・函館警察署・函館市衛生組合連合会・函館市醫師会・函館眼科醫会・函館市小学校醫会・北海道眼鏡協会函館支部・帝国電力株式会社・函館産婆会・日本衛生会函館支部、厚生省・文部省・拓務省、大東印刷納、昭和拾参年の印あり,,,77.0×53.0cm,,po000476
六月四日　ムシ歯予防デー,サインあり、昭和拾参年の印あり,,,76.5×52.5cm,,po000477
第十三回結核予防デー　12.6.27,第十三回結核予防デー　12.6.27、結核予防、北海道衛生組合連合会、懸賞募集＝一等當選、函館市衛生組合連合会、小樽・札幌塩野其水堂印刷、結核予防十戒の紙付き,,,78.0×53.0cm,,po000479
6月4日全国ムシ歯予防デー,,,,78.0×55.0cm,,po000480
